Nationality,ID,letter,text,,
British,na_uk_31,50,"Several months ago, when we relieved the French of these trenches it was noticed how quiet the ‘atmosphere’ was, and it seemed quite in keeping with the beautiful hilly scenery. Since the British occupation however, things here have livened up considerably, and it has been found necessary to greatly strengthen the trenches, and make dugouts much deeper and safer, because of the various kinds of souvenirs sent over from the enemy. Their latest was the aerial mine, of which no doubt you have read. It is exactly like an oil drum to look at, with wood ends, and explodes with a terrific report. I don’t think it can be fired from a gun, as it comes tumbling across in such an awkward manner. I don’t think we manufacture these articles at Woolwich as we can afford decent shells! We are not troubled very much by German artillery, but they make up for that with trench mortars and rifle grenades. As a signaller I escape some of the hardships of trench life, especially now the winter has arrived, and much prefer duties which keep one under shelter to those of exposure at the parapet! Of course we have exciting times, when any wires are cut by trench mortars etc. and which need to be repaired at once wherever the break is. Just lately I am having a lot of experience at making and fitting fireplaces in dugouts. We generally use biscuit tins to hold the fire and rummage among old houses in the village nearby for pieces of piping to take the smoke out, usually through the entrance as it is impossible to cut a hole through the roof on account of the sheet of iron. Fuel for burning is generally a problem but a small supply of coke is allowed and we add to it all kinds of wood etc. When sitting up at night it is surprising what good time we keep when waking up the next fellow to carry on, if there is no fire, but if a good fire is on, we get quite generous, and don’t mind allowing the next man an extra hour or so to sleep!\n\nWe have had several days of rain this week, which doesn’t tend to improve life in the trenches, or out. On our journey to billets last Saturday night, we took a road through a wood constructed by the Royal Engineers. It wasn’t quite finished, and in places was ankle deep in water, so our march was more of a paddle. Parts of this wood, which is in a valley had been purposely flooded, so the road had to be laid on faggots and will be a piece of work when finished. We are fortunate in having dry billets, with beds raised above the floor and a small fire. Sheep skin coats have been issued to us, and are very warm. There is a fellow here now imitating a monkey and holding out a small cup to an audience seated on the beds, while another chap is playing an accordion! All we need now are top boots (tall rubber waders or gum boots designed to try and avoid the problem of trench foot) to paddle through the trenches! There is plenty of water about but very little to drink or wash in. It is a fine place for people who are good at finding excuses for not washing! But there are very good hot water baths here, only it isn’t any good having a bath unless one really needs it, on account of the colour of the water!! We do very well though, for food and clothing both of which are good, and well supplied, and considering the many distant places it is sent from, it speaks well of the splendid way our Navy is doing ‘its bit’…",,
British,na_uk_32,51,"Dear Arthur,\n\nI really must make this effort to write to you and let you know how I am progressing. Well so far as a little internal trouble I’m keeping fairly fit now that the cold weather has started, and on my present job I can doctor myself, I am prepared to stick this campaign until further orders.\n\nWe are now in our winter quarters and a very nice place it is. Right on the edge of the cliffs, with a beautiful sea below, it reminds me very much of Cornwall. Then just across is the island of Imbros, and the sunlight on those mountains is sometimes marvellous. On a quiet, warm day, with the birds singing, one wonders if there is a war on, but the blooming shells soon drive that idea away. It’s jolly cold now though, but we have been served out with nice thick underclothes, and waterproofs, and top boots and except for always living in the ground, our comforts have been looked after as far as possible. Our food is as good as anyone could want, also I’m now used to a lot that before I’d turn my nose up at, and so long as the ships can land the goods I don’t think we shall be so badly off.\n\nMind it does blow, and the sea gets awfully rough and then no ships can come near us. We have the sea on three sides and the Turks on the fourth, so we are truly between the devil and the deep sea. The Turks still find some ammunition from somewhere whether our guns and the warships knock the very dickens out of them. It’s very exciting to watch a battle especially now it’s on our side the guns are not like at Antwerp where we were the ones potted. Now I am too sleepy to continue and as the firing has quieted down I’m going to sleep and continue tomorrow.\n\n5/12/15. I’ve not had a chance to finish this letter before, so here goes. We’ve had snow and rain and thunder and such lightening, and Lord it has been cold, everything frozen and even the water in my water bottle. But today has been beautifully mild and calm, almost like summer again. I have just received a packet of letters from my wife, written at different times since May, so am still in hopes that there may be some more back dates knocking around the world for me. We had three men killed last night in a little spasm, and today our guns and the Turks have been flinging dirt at each other. We used to duck once upon a time, as the shells came over, but now everyone seems curious to see what sort of a burst it will be and how much dust is knocked up, and heaps have cameras taking photos.\n\nEnclosed is a bit of heather which grows in great profusion all over the peninsular. And the troops use in the trenches to boil their dixies on. And now about the office. Do you know but, it’s quite an effort to remember the routine now…\n\nI suppose Mr Millow is still with you and is there any chance of H.R.H. Goff joining say as a S.C. (probably Senior Clerk)? There is now a singing in the air and bang just as I write they’ve dropped one over to us. Sometimes a shell bursts, and when we are working at something we don’t even know it’s come along. It’s funny what you can get used. But to get back to the office. I expect you have heaps of ladies there now, lord I haven’t seen a woman since April. What do they look like? I expect they scent out the office, and how careful you all must be not to swear. We often laugh here at the thought that if ever we do return to civil life again, we’ll be digging a little hole in the garden to live in and stirring up our tea with a bit of stick or our finger and just spit on the floor when smoking and if a little tickling in our shirt, just hopping it off in the street.\n\nI am out of paper (he is writing this on envelope), but it don’t matter. How are the lambs going? Here’s one that’s doing a little doing a little bleat far from home. I’d like to come you know, and have a rub at a bed and a roof, also a drop of beer perchance. Living in a hole for seven months now and the blue sky above gets a bit monotonous at times especially when the dirt will persist in falling on your face when you are trying to sleep and when it rains you’re up to your knees in no time, and that’s always at night. We had rum served out tonight and do you know, I can’t bear the stuff, just pause and think by the wayside, I can’t drink rum, in fact I hate it. How we do change by time. Now how is everyone down the club? Remember me to Emmie and Mrs Fellows and May. I understand that Mr Welsh and Mr Davies have been awfully kind to my wife, and I reckon its jolly good of them. This war seems to have found me so many kind friends, I don’t know what I’ll do to repay them all if I live through this…\n\nWhat has become of Beaumont and Jackson, and is my pal Jimmy Edwards still alive,… Bert I’d like to send you a Turkish shell but the post office won’t accept them for transit, anyhow perhaps I’ll bring home a nose fuse for a paper weight. Do you know back in the summer I had a shell drop just off the seat of my trousers and it did not explode. Kaw! It was a bit of luck, I didn’t stop to pick him up though, in case he changed his mind later. Well now I’ve tried to remember everyone, but do you give heartiest good wishes to the office for a Merry Xmas and a victorious New Year and trusting you’ll all be safe from Zeppelins. Yours very sincerely,\n\nT. Harold Watts",,
British,na_uk_33,52,"The last time I wrote I think I told you we had lost our comfortable job on\nrailheads. We have been shifted from General Headquarters and are at\nthe most godforsaken hole there can possibly be in France. We had a\nrotten journey raining all the time. Reveille* was at 4am and we\neventually left the station about 10am. The accommodation consisted of\nthe old cattle trucks, and rations of bully and biscuits. It was a very cold\nand uncomfortable journey.\nWe arrived at our destination about 4.30pm and after standing in the rain\nfor 2½ hours with full pack on, we set out on a ten mile march. It’s the\nworst march I’ve ever done. The majority of us at the finish were\nabsolutely knocked up and were only too glad to crawl into the billets\nbefore going to bed, which was about 12pm. They gave us a mug of tea\n(the first we had since six in the morning) and best of all a ration of rum.\nThe up to date soldier kit to carry about from place to place consists of\n150 rounds of ammunition, inside the pack; overcoat, fur coat, two pairs\nsocks, one pants, one shirt, ground sheet, iron rations [emergency food\nsupply]. Outside pack; Mackintosh and mess tin, in haversack; cleaning\nkit, hold all, 24lbs rations, soap and towel, and on top of that extras such\nas handkerchiefs, plate, mug, tobacco, etc, two smoke helmets* in a\nsatchel slung over the shoulder, a respirator in the left flap of a tunic and\nfield dressing on the right, and of course the rifle, in all it’s no light weight\non a long march, it takes all one’s strength and staying power to keep\ngoing.\nWe are billeted in a barn and have a sea of mud to get through. We have\nno boards, so sleep on the ground, fires are not allowed in the billet and\nat night time it’s devilish cold.\nIn the village there is a little general shop (now nearly sold out), one pub\nwhere they sell something they charge 2½d for and call beer, there are\nno shops of any description and of course no amusements.\nRations are not so good now (today’s dinner, Sunday, bully beef, stew\nand two potatoes between 35 men. We have a loaf and a bit (small loaf)\nand two tins of jam between seven men, the short bread issue being\naugmented by the world famous army biscuits.\nOur captain is a perfect gentleman and about the most popular man in\nthe regiment, the junior captain (an absolute sport) and the platoon\nofficers are all very decent sort of fellows. We appear to be much better\noff in this respect than before, and certainly think that D. Co. has got as\ngood a selection of officers as any other company in the battalion. One of\nour fellows ran across a number of Audit R.E.s and they enquired after\nMaggs and myself.\nFreddy or\nWhat’s left of him after some very stiff marching.",,
British,na_uk_34,53,"Dear Mr Hunt,\nI expect you have heard at the office about me being in England suffering\nfrom gas poisoning, and as it is quite a long time since I last wrote to\nyou, no doubt a few lines will be acceptable, to explain matters.\nWe left the trenches at Vimy Ridge on July 5th, and marching back about\n14 miles we eventually reached a village named Ostreville for the purpose\nof having a divisional rest. The signallers thought an orchard would be\nvery convenient to erect bivouacs in, so when we were busy carrying out\nthis idea an old Frenchman appeared at the scene, and raised objections.\nHowever he agreed at last to allow us in at one end of the orchard,\nthinking, I suppose, that we would wander about his place! We had an\nenjoyable time here for six days, and then had to return to our old billets\nnear Mount St. Eloi until the whole of the division had retired. We guessed\nby this move that our ‘rest’ was over, and the following days were spent\nin marching, and travelling by motor lorries and train until we arrived at\nMericourt Station on July 21st near Albert.\nAfter a delightful swim in the river near the billet we marched off the\nfollowing night, to take part in the ‘big push.’ We slept in an open field\nthat night near Fricourt farm, and were rather rudely awakened by a few\nGerman shells landing near us.\nFor five days we were lying in reserve in this district, and occupied our\ntime in watching an army of men at work in the valley, making roads,\nrailways, boring for water and laying down water pipes, also practicing\nattacks in the old trenches. It was very interesting to see the great\namount of artillery, busy practically all day and night, and to read their\nmessages sent by visual signalling [often using lights] from a ridge across\nthe valley.\nOur period in reserve being up, we moved to Mametz Wood to lie there in\nsupport for five days, before going into the trenches at High Wood. On\narrival at the edge of the wood at night, we were welcomed by a big dose\nof gas shells and shrapnel, which was applied steadily throughout the\nnight by the German artillery. Having to assist in putting our signalling\ngear into a hole for safety, I was prevented from using my respirator for\nthe first quarter of an hour, as we could not see on account of the\ndarkness and dust made by the ammunition columns rushing along the\nroad, and it was during this time that I must have breathed in enough gas\nto put me out of action. Afterwards of course respirators were used, when\nwe were settled in holes by the roadside for the night.\nI remained with the battalion until I was sent to the casualty clearing\nstation on August 3rd and reached Rouen hospital the next day. I had to\nwait until the 9th and crossed the channel from Havre to Southampton on\nthe New Zealand ship Marama, with about 800 other patients, the day\nafter. It was a splendid boat with every convenience for carrying wounded\nmen, and the sisters and orderlies were colonials.\nIt was last Friday week when I arrived here, and must say it is very\ncomfortable and quiet. I had to remain in bed until last Saturday, but of\ncourse I cannot do any route marching yet! So I have to take life quietly,\nwhich is no hardship I can assure you after France. I am on an ordinary\ndiet, and taking medicine.\nI hear you have Mr Symons back again, is that so? And is he back in the\nsame old spot? I hope he is pretty fit, although I suppose there must be\nsomething wrong with him, to be back again.\nI suppose things are as quiet as usual with you. Have you had your\nholidays yet? This is about your time I believe. I shall be glad of a few\nlines when you have time, to hear the latest about the office. I hope you\nare keeping fit, also Mr J.B. Taylor and Mr Woodhams and with kind\nregards to you all. Yours sincerely,\nFrosty.\nP.S. It is a treat to write a letter without the censor’s shadow over one!",,
British,na_uk_35,54,"Dear Mr Hunt,\nThanks very much for your letter which I received a week or two ago, also\nfor the magazine.\nWe are in the trenches just now. In fact we seem to spend about three\ntimes as much time in as we do out. Also we are in a pretty warm spot, it\nwas about here, towards the end of last summer that the French and\nGerman had some of the fiercest fighting of the war. The country around\nabout is a veritable maze of trenches. The fighting at one time was so\nfierce that there was only time just to bury the dead in the sides of the\ntrenches, and now that the trenches have crumpled one is constantly\nseeing the bones of men’s legs or their boots, or skulls sticking out from\nthe sides of the trenches, pleasant, eh? There will be a pleasant smell\nhere in the summer. I only hope we are not here then. In places we are\nonly about twenty yards away from Fritz and company. Consequently all\ntimes the air is pretty thick with bombs, grenades and trench mortars.\nThese last are pretty hellish sort of toys. They have an explosion like\nabout ten earthquakes rolled into one. But even these are not the worst\nwe have to put up with. The trenches being so close together there is of\ncourse any amount of mining going on. So one never knows when the\nparticular lump of earth one is standing on is going to take a trip through\nthe solar regions. When a mine does go up, there is some excitement\nknocking about I can tell you. Suppose for instance we were going to\nexplode one, all the artillery in the neighbourhood is ranged on the spot\nand directly the mine is exploded, there is hell let loose on the crater. Of\ncourse as soon as he gets the range the enemy replies, so that the air is\nfairly full of everything that kills quickly. One can on these occasions\nalways rely on a good many casualties. Since we have been in this spasm\nthere have been five exploded in this neighbourhood, while others are\nexpected to go up at any time. So much for conditions here.\nHow is everything in town? Pretty quiet I suppose. I see you’ve had the\nzepps (Zeppelins) over again? Is it a fact that one dropped in the\nThames? (Lines censored.) That is about all the news, so will close,\nkindest regards to everybody. Yours very sincerely,\nGilbert Williams.",,
British,na_uk_36,55,"Dear Mr Smith,\nI hope you will accept my apology for not writing before. It has not been\nwant of will it has been lack of opportunity. I wonder how you all are. I\nam fairly well now but was very queer for several weeks recently. I also\noften wonder how you are all getting on and should like to hear.\nA matter of about five minutes ago Fritz was bombing us, and I have just\ngot up off the ground where I was laying for about twenty minutes. One\nfellow has been hit, but not severely by shrapnel. This is his second visit\nthis evening.\nIt will soon be twelve months since I left you. It seems a very long time\nago. I am afraid I have very little I may tell you, so will conclude by\nasking you to accept my best wishes for the New year and desiring that\nyou will remember me kindly to any enquiring friends. Believe me, dear\nMr Smith, sincerely yours,\nW. Wiggs",,
British,na_uk_37,56,"Sunday\nDear Charlie,\nHow are things going with you now? I expect like the rest of us will be\nglad when the better weather sets in for there is no doubt about it, it has\nbeen rough lately.\nSince I last wrote to you we have shifted to another part of the line and it\nis a warm shop, for both sides must have all guns they can find and it is\nnothing but one long duel all day and every day but thank goodness it\ngives over a bit a night so that one can get on with their work. You see of\na night the flashes of the guns can be seen so plainly that is why they do\nnot fire a lot then.\nJust on our right our people retook some trenches we had lost, oh what a\nrough time the poor devils had, snow and mud as much as you like and\nthey had to lay in it for two days and grub could not be got to them. I\nexpect there have been a few more from Paddington called up by now, it\nseems if the authorities mean to have all the men they want and if they\ncan’t get them one way they will another, and it certainly looks as if they\nwill be wanted for out here. One cannot see any signs of an early\nsettlement. I see by the papers that the air raids have been busy in\nEngland again. I suppose you have not seen anything of them yet, has\nRory Moore had any more frights? We have the taubes [German aircraft]\nover our hospital nearly every day or night and I can tell you we got some\nstarts at times. The nearest we have to them since I have been here is\njust one yard from the main door, at 12.30 it blew in two pairs of double\ndoors and shattered on end of the building to bits but not a great deal of\ndamage to life which after all is the main thing. The arrangements we in\nwork is five or six days up the line and four or five down if you are lucky.\nOf course at times these arrangements go to pot when there is an attack\nand we get a warm time and I should like to enlarge on these things but\nof course you understand I cannot.\nGive my kind regards to all and trusting you are well.\nYours Will",,
British,na_uk_38,57,"Dear Mr W.H. Davies,\n\nJust a line to let you know I have not forgotten you. I received a letter on\nTuesday 3rd of January 1917 which you sent to me on August 24th 1916.\nBy the marking on the envelope it has been round to various regiments\nand officers, but it has arrived quite safe at last. I received the letter you\nwrote in October quite safe. I am sorry I have not written before but we\nwere rather busy when I received your last letter and we could not send\nmore than a field card for about a month. Well I am pleased to tell you\nthat I am still going on first rate. I expect you will be surprised to hear\nthat I have left the Northamptonshire Regiment and am now attached to\nthe Army Printing and Stationary Services. We are opening a new branch\nin the photography line and I am here as a photographer.\nI am unable to tell you more than this up to the present. I expect Harry\nwill be pleased to hear this as he used to give me quite a lot of tuition in\nthis respect.\nThere are only two of us here up to the present and as the dark rooms\nare not finished yet we are having an easy time. The Officer is away in\nEngland just now getting some more photographic apparatus so we are\non our own and I am in charge.\nWe are billeted with a company of Australian electricians, mechanics,\nmining and boring engineers and are having a fine time. There are a good\nlot of fellows and make us very welcome. We had a grand Xmas with\nthem and they know how to enjoy themselves. You can understand what\na change this is after being in the line. Just before I came on this job we\nhad over a month in and out of the line waiting to go over the top when\nthe weather was favourable.\nWe went in for four days then out for a rest for about three days then\nback again. The water was over our knees in the trenches and it was\nimpossible to use the communication trenches at all. We were holding the\nfront line with two platoons (I should say our boys’ section of the line).\nOur platoon was twenty two strong including the Officer, and during the\nbombardment we had eight put out in ten minutes. There were no\ndugouts of any description there, so you can imagine what it was like to\nstand there for four nights. We hoped the weather would be alright so\nthat we could go over and get it done with but it was not to be. We were\nout digging one night when they let us have it for five hours with gas\nshells, we had two chaps hit with them and put right out.\nThe sights and smells were awful, as a good many of the chaps lay just as\nthey fell during the advance. It was impossible to bury them. Also there\nwere about a dozen dead horses round about in the mud that were killed\nby shell fire while bringing up ammunition for the guns. Our guns never\ncease down there, as soon as one section stop, another lot open out so\nyou can tell there is Somme noise.\nThe last time we came out, was for forty eight hours’ rest then in again\nand over, but the troops were in such a bad condition that the doctor sent\nin a report saying we were not fit for the line so two other regiments in\nour division went over in our place.\nWe were held in reserve and I am glad to say not required after all. Well I\nthink this is about all, for now, I have been with the A.P. & S.S. since\nDecember 1st and I can tell you, I hope I shall stop here. I have no desire\nto go back to the line. Kindly remember me to all old friends. With kind\nregards to yourself and all on Section 4.\nYours sincerely, H.A. Skilling\nNo. 2 Section Advanced Section\nArmy Printing & Stationary Service…",,
