Nationality,ID,letter,text,,
British,RC_01,71,"My Dearest Will, I feel I must write you again dear altho there is not much news to tell you. I wonder how you are getting on. I shall be so relieved to get a letter from you. I can't help feeling a bit anxious dear. I know how you must have felt darling when you did not get my letters for so long. Of course I know dear you will write as soon as ever you can, but the time seems so dull and weary without any news of you, if only this war was over dear and we were together again. It will be one day I suppose. Don't think dear I am worrying unnecessarily about you, because I know God can take care of you wherever you are and if it's his will darling he will so are you to come back to me, that's how I feel about it dear, if we only put our trust in Him. I am sure he will. I wonder how your Cousins are getting on dear. We are feeling very anxious about George, as no news has come from him yet. We can't understand why his wife doesn't write. How are your hands now dear? Mine are very sore, so chapped, and my left hand has got several chilblains on it and they do irritate. I could scratch it to bits. Have you been receiving the books I have sent you dear. I am very pleased to say dear I am keeping very well indeed, and I trust you are the same. There has been a bit of a fuss over Arthur this week. He has been trying to get in the Army unbeknown to his parents, but Mrs T. thought his parents ought to be informed about it, so she wrote and told them about him and he had to go home in hot haste last night. I guess he got in a fine row, but he won't say today. He is as miserable as anything. Really Will I never saw such a boy as he is. I am afraid he is going to the bad. I don't know if Mrs T. will keep him on or not. He says he has to join up in a fortnight, but as he is under age I suppose his parents could stop him. I don't know whether they will or not. For my part I hope he does go, he will be a jolly good riddance for there is nothing but rows and deceitfulness going on where he is. Well darling I don't know much more to say now, so will close with fondest love and kisses from your loving little girl. Emily. P.S. Cheer up darling, and don't worry about me. I am quite alright, only anxious to get your letters. There is good news in the papers. Love from Mum and Dad.'",,
British,RC_02,72,"Dear Gertie, I have written two or three times recently so you may get them together. We have been very busy for the last few weeks and have got through a great amount of work. We are much better off again as regards potatoes and other food stuffs for we have had a great quantity of stores. I fancy we shall be here for a time yet anyway it looks like it with such a quantity of stores aboard. You will see I am telling you the same things over and over again. At least I know I have told you them once or twice but everything about is all of a sameness kind of thing. Ships here there and everywhere now. But soon we shall have a move that is when we can get through the White Sea. We shall have to look after all the shipping. The snow is fast disappearing now. I came across an article in a paper the other day about this district and it said that 14 or 15 years ago bears used to roam around hear [sic], but there seems to be nothing around now excepting the wild fowl, which are very numorous. I believe salmon are numerous at certain times of the year. The 2nd and 3rd of May we had a terrific snow blizzard. We should have left the ship to go away and do some work on another ship but we could not get away from our ship it was so rough. We have no night now, the sun goes down but it never goes dark, it is eternally daylight. Of course I told you we have had an entire change round and I have a new job now, part of the ship. I have not half the time I used to have but I enjoy the robust work much better and I get to see much more with working away. We get up at 6.30 and work until 1.00 so we put a few hours in don't we. That is when we are working away. Did you get the £1-0-0 I remitted? Let me know. I have remitted another £3-0-0 this month. Let me know if you receive this also. I shall probably send a little more next month or later. Don't hold the paper money. Bank it or keep it by you in gold until I come home. Tell Dad I shall to him as soon as I can get enough to tell him about. Give my best love to everyone at home, I often think about you all. I am yours ever, Ted.'",,
British,SE_01,73,"The soldiers at the front need more rest. While in the trenches the water is over our knees most of the time. The war is going to last some time yet, and might be another twelve months before it is over. The war has only just begun and its going to be a war of exhaustion. After the regular armies have done their work it means that all the young lads at home being trained and disciplined and will take our place in the field. The sooner people understand this, the better, it will be for the nation.",,
British,SE_02,74,"We have just come out of the trenches after being in for six days and up to our waists in water. While we were in the trenches one of the Germans came over to our trench for a cigarette and then back again, and he was not fired at. We and the Germans started walking about in the open between the two trenches, repairing them, and there was no firing at all. I think they are all getting fed up with it.",,
British,SE_03,75,"We started away just after dawn from our camp and I think it was about an hour later that we encountered the enemy. They were on the opposite side of the valley and as we came over the brow of the hill they opened on us with rifle fire and shrapnel from about 900 yards. We lost three officers and about 100 men killed and wounded in that half hour. I do not want any more days like that one. (this section censored) Anyway we drove the Germans back and held them there for eight days. I cannot tell you all I should like to, as it would never reach you.",,
British,SE_04,76,"I have not written to you for a long time, but I have thought of you all the more as a silent creditor. But when one owes letters one suffers from them, so to speak, at the same time. It is, indeed, not so simple a matter to write from the war, really from the war; and what you read as Field Post letters in the papers usually have their origin in the lack of understanding that does not allow a man to get hold of the war, to breathe it in although he is living in the midst of it. The further I penetrate its true inwardness the more I see the hopelessness of making it comprehensive for those who only understand life in the terms of peacetime, and apply these same ideas to war in spite of themselves. They only think that they understand it. It is as if fishes living in water would have a clear conception of what living in the air is like. When one is hauled out on to dry land and dies in the air, then he will know something about it. So it is with the war. Feeling deeply about it, one becomes less able to talk about it every day. Not because one understands it less each day, but because one grasps it better. But it is a silent teacher, and he who learns becomes silent too.",,
British,SE_05,77,"I have an old platoon roll before me; three pages of names, numbers, trades, next-of-kin, religions, rifle numbers, and so forth. Faces come back out of the past to answer to these barren details, the face of this man dead, of that vanished for ever. Here and there rise memories of their habits, their nicknames, the look of one as he spoke to you, the attitude of another shivering in the night air, as he leaned over the parapet, watching with tired bloodshot eyes. Some of the faces have disappeared. did I know you? I censored your letters, casually, hurriedly avoiding your personal messages, your poignant hopes.",,
British,SE_06,78,"We are now 150yd from Fritz and the moon is bright, so we bend and walk quietly onto the road running diagonally across the front into the Bosche line. There is a stream the far side of this - boards have been put across it at intervals but must have fallen in - about 20yd down we can cross. We stop and listen - swish - and down we plop (for a flare lights everything up) it goes out with a hiss and over the board we trundle on hands and knees. Still. Apparently no one has seen so we proceed to crawl through a line of ""French"" wire. Now for 100yd dead flat weed-land with here and there a shell hole or old webbing equipment lying in little heaps! These we avoid. This means a slow, slow crawl head down, propelling ourselves by toes and forearm, body and legs flat on the ground, like it snake. A working party of Huns are in their lair. We can just see dark shadows and hear the Sergeant, who is sitting down. He's got a bad cold! We must wait a bit, the moon's getting low but it's too bright now 5 a.m. They will stop soon and if we go on we may meet a covering party lying low. 5.10. 5.15. 5.25. 5.30. And the moon's gone. The Bosch is moving and we crawl quickly on to the wire - past two huge shell holes to the first row. A potent row of standards are the first with a nut at the top and strand upon strand of barbed wire. The nut holds the two iron pieces at the top and the ends are driven into the ground 3ft apart. Evidently this line is made behind the parapet and brought out, the legs of the standard falling together. All the joins where the strands cross are neatly done with a separate piece of plain wire. Out comes the wire cutter. I hold the strands to prevent them jumping apart when cut and Stafford cuts. Twenty-five strands are cut and the standard pulled out. Two or three tins are cut off as we go. (These tins are hung on to give warning and one must beware of them.) Next a space 4ft then low wire entanglements as we cut on through to a line of iron spikes and thick, heavy barbed wire. The standard has three furls to hold the wire up and strive as we can, it won't come out. ""By love, it's a corkscrew, twist it round"" and then, wonder of wonders, up it goes and out it comes! It is getting light, a long streak has already appeared and so we just make a line of ""knife rests"" (wire on wooden X-X) against the German parapet and proceed to return. I take the corkscrew and Stafford the iron double standard. My corkscrew keeps on catching and Stafford has to extract me twice from the wire, his standard is smooth and only 3ft so he travels lighter. He leads back down a bit of ditch. Suddenly a sentry fires 2 shots which spit on the ground a few yards in front. We lie absolutely flat, scarcely daring to breathe - has he seen? Then we go on with our trophies, the ditch gets a little deeper, giving cover! My heart is beating nineteen to the dozen - will it mean a machine gun, Stafford is gaining and leads by 10yd. ""My God,"" I think, ""it is a listening post ahead and this the ditch to it. I must stop him."" I whisper, ""Stafford, Stafford"" and feel I am shouting. He stops, thinking I have got it. ""Do you think it's a listening post?"" There! By the mound - listen."" I laugh, ""Forgot that damned wire."" (Our own wire outside our listening post). The LP occupants have gone in. Soon we are behind the friendly parapet and it is day. We are ourselves again, but there's a subtle cord between us, stronger than barbed wire, that will take a lot of cutting. Twenty to seven, 2 hrs 10 minutes of life - war at its best. But shelling, no, that's death at its worst. And I can't go again, it's a vice. Immediately after I swear I'll never do it again, the next night I find myself aching after ""No Man's Land"". 
",,
Australian,AU_arc_01,79,"you must excuse me for being so long in writing as I feel like crawling into a hole and never coming out again, I’m the miserablest and sorriest man in all the world since poor old George was killed we were like brothers, we were never apart out of the lines, they used to call us husband and wife in Batt [Battalion], so you can tell how much I miss him. I did not know he was killed until we came out of the lines either, as he was transferred into the Machine gun section a few weeks ago and I was in the bommers [sic], it’s the first time we had been parted in the lines, oh dear Jeanie the way I feel this last few weeks I wish I were gone with him. Well dear little girl I can just imagine how you
all fell [feel] at home being so far away but we will all try and cheer up and pray to
God that we may meet in the next world, everyone [in] the Batt thought such a lot of
him, he was so good and kind, anyone that knew him couldn’t help but like him and
he had grown such a fine boy since he left Australia, he must have stood six foot and
was nearly 13 stone, so you can guess how he filled out and grew, I can’t realise [sic]
its true yet, oh how I wish it wasn’t, every line makes my heartache, no dought
[doubt] poor boy he is better off but it is us that are left behind that will suffer, all his
dear ones that loved him so well but we will all bear up a little for poor old Georges
sake, he wouldn’t like to see all so downhearted, I am sure of that. I am verry verry [sic] sorry to have to bring back old memories to all Georges dear
ones at home but I know you would like to hear as much as you can about him, he
was never so happy as when he was in the lines plugging at old Fritz. I’ll bet he
made the dirty wretches suffer this time with his machine gun before he died by what
I can hear from one of the chaps that was near him at the time, he was killed
instantous [instantaneous]. It was on the 5th of April at a place called Dernacourt
[word censored], poor old boy was shot through the head, as soon as we go up there
again I will do his grave up with some flowers, we are trasferred [transferred] into
different Batt, now there is [words censored]. Well dear Jean I will close with deepest
sympathy to all at home and with tons of love to all your sincere friend Aussy ",,
Australian,AU_arc_02,80,"Many thanks for your bright & chirpy letter of 16 October. I have attended Church Parade this afternoon & after the dullest of dull services conducted by a Padre who it seems to me was quite without personality your letter was particularly welcomed. Don’t look to me to give your Parisian accent. Firstly, I think it most improbable that we will have any opportunity of visiting Paris, which … compliment I will assume is the only fine place in this country. Secondly I haven’t even as much bothered to concern myself with the easiest phrases. I haven’t much time for one thing & certainly
have no inclination. I confess to having no love for the country or the people, & I will
should the War finish tomorrow I would be only too glad to say goodbye to the place for
ever.
We are getting a taste of Winter alright. The sun very rarely shines, & we have a kind of
daylight from about 8am to 4pm, but it is rather dull, & often foggy.
I am particularly well & in spite of commencing this letter in the strain I have written in
excellent spirits. After coming out of the Trenches this last time I wasn’t too good for
several days. We had a hard time of It, & to add to our trials had to tramp for about eight hours before reaching the Camp
placed for us. I had had practically no sleep for four days, had lived in mud 18” thick, thro’
rain & snow & felt absolutely done up. I struggled into a hut, wrapped myself in a couple
of blankets & hardly stirred for over 24 hours. I then made an effort to tidy myself. My
appearance when I had a look at myself in a mirror was mirth provoking beyond doubt. A description is beyond me, but try & picture in mud & rain soaked clothes, hair unbrushed
for a week, face unshaven & unwashed for a similar time & still carrying much Trench
mud & other varieties of that despised article We are now quietly billeted in a very small village. As a matter of fact the village reminds
me very much of the Homestead & outbuildings in a large farm. These are all clustered
together, very old whitewashed & with thatched or tiled roofs. The villagers are all poor.
The surrounding country is all agricultural, & no matter which direction you take you will
not find even the smallest area not under cultivation of some sort. Of course there are no
fences, quite a feature in this country. The county is interesting in a sense, low hills rising
& falling anywhere. They build small Haystacks here, & it would take three or four of them
to make one of the usual stacks which we are accustomed to at home.
I shall be mighty glad to get home, & I will have much pleasure in singing “Good
Company” to your accompaniment. We make a big noise at times. As a matter of fact it it
hadn’t been for a few choruses the train journey we had a few days would have been
unbearable.
I hope you meet with success as School-marm. I love that term. Do you remember a
novel called the “Virginian” by Owen Wisten very popular a few years ago. The heroine
was called by that title & a jolly fine story it was too.
Expect to be in the line overtimes. We will be out I think for about another fortnight. Trust
we will have an easier time than last, which was very serious.
Hope to hear from you often. Perhaps next time may be more cheerful. Feel that I’ve
been rather blue dull this time, but blame the weather.",,
Australian,AU_arc_03,81,"Many thanks for your letter, which I have just received. During the last few days I have been favoured, too, with letters from your sisters Carrie and Nellie to whom I have also written by this mail. Well, I liked you playing tit for tat as regards your name and address, but the pencil! I’ve
a good mind to purchase a dozen fountain pens and never write in pencil again. I’ll
excuse your pencil writing this time, but please try to imagine daylight from about 8 a.m.
to 3.30 p.m. and always dull, when you are about to write again. We have been through a pretty exciting time during the last month, Was under another
attack, made under very heavy machine gun and rifle fire, and had a dinkum fight with
bombs. I got through without harm, which is rather marvelous. This was our first time in
the trenches. Our second was a little quieter although we had a pretty big job on one
night, which was more than ordinarily dangerous. The next morning we had our first experience of snow (how would you like a little of it
now?) after which it rained continuously all day and night. We were relieved that night,
and then moved back to a camp, taking eight hours to do the journey. You might be able
to imagine the state of the country after the rain. It is nothing but shell holes which have
been partially filled with water, and the ground was slippery. We were in a fine state when
we reached our destination. We are quite happy now, however. I have been away from the line for a fortnight, and
feeling much refreshed. It was a great comfort to get a comfortable bed, to be able to eat
in a civilized manner at a table, to be able to wash your face daily, and even to have
warm water for a shave. We are billeted in a small village, a very old place. It is quite
clean however, and it is a treat to be able to move about on roads which were not a foot
deep in mud. Between our two tours on the front line we were camped in huts placed 150 yards off the
road, and the whole surrounding area was mud a foot thick. It was glorious! The roads
weren’t much better, the traffic on them being enormous. Continuously a stream going
each way, the poor old infantry trying to wend their way through all this, in constant
danger of being wholly crushed by a motor lorry or else being trodden on by a heavy
draught horse, and collecting quantities of mud on uniforms and faces. It is extremely cold, but I think I can stand this alright. It is so cold that a small lake on the
roadside has remained frozen except where broken by idle stone throwers, for several
days. I like this place, and would be perfectly satisfied to be here for the ‘duration’. It is
very quiet, but I never want much else than a quiet life when out for a ‘rest’. The so-called ‘rest’ consists of parades, a greater length than we are used to in Australia, but they are
most essential in building us up after trench life, which makes one horribly tired. I am having a great time tonight, writing to catch the mail which is leaving here next
Saturday. There will probably be very little opportunity again for a few weeks.",,
Australian,AU_arc_04,82,"Many thanks for your congratulations. It has been particularly gratifying to my vanity receiving numerous letters from my SA friends and it almost requires a superhuman effort to act and think normally. However, I am persuading myself gradually that I am only a very ordinary soldier who up to now has been exceptionally fortunate. Before attempting a brief outline of my recent work I wish to thank you for the miniature
photo which I like very much and am very glad to have. I hope the time is not far distant
when I’ll have the opportunity of calling at 183 Archer Street and letting you see that I am
still in possession [of it]. And you mustn’t allow such a long interval to happen again. I
enjoyed your last one immensely. When I get home again I’ll see that the detail about the
size of the photo is put right. I notice that you were staying with Chris Kneebone’s people when you wrote. I wish he
was with the battalion at present. He was away sick in November and has not yet come
back. I understand that he has been doing well, but I am afraid that he will be sent to the
3rd. battalion in the next Division being formed in England. If he were here at the present
time he would have a splendid opportunity for promotion. At present we are right forwards, and as our work is done entirely at night I usually put in
an hour in the afternoons writing letters to friends in SA – quite the most pleasing way of
diverting one’s thoughts and attention to the shelling that is always going on. We were a
long way back, enjoying a fortnight’s rest before moving up this time. One fine day we
made a long march, about 12 miles, carrying full weight. It was quite enjoyable,
particularly the latter part of the journey, when we were in comparatively fresh country. [It
is] a great relief from the dismal area where the opposing forces held lines and trenches
for so many months. During the last eight or nine weeks we have made great advances forwards and the
whole aspect is changed. It is a wonderful tonic to everybody, this pushing of the enemy
back. We were in tents for three or four days and these were more or less miserable,
having to do pretty heavy work in continuous rain. The night we moved up here it was
fine and ever since [we] have had fine days. We have been here six days and the
weather has been glorious. Fine clear cloudless days – just a slight keenness in the air –
and the nights moderately warm. You would scarcely realize the difference in the
conditions now and those of ten weeks ago. Preparations [are being made] for another
big push, and practically all the work is done at night. We have posts in the trenches,
which can be made more comfortable than usual. Others have little shelters built into the
sides of sunken walls. I am at present in charge of the company I am attached to. With a bit of luck I would have
now been enjoying ‘Blighty leave’. My OC was evacuated sick, so I couldn’t be spared.
(conceit!). However, it isn’t too bad up here. I am having some enjoyment in the way of
letter writing. You should just see my new quarters. Where I am there is a sunken road,
as a result of many hours of work, and it has now built into quite a ... home. Of course, if
a shell hit the bank I’d probably get smothered and there is always the chance of
shrapnel finding a passage in, but such contingencies cannot always be provided for.
And if there were absolutely no risk, what a dull show it would be! – I don’t think! Maybe we’ll be relieved up here in about a week, when I shall, in all probability, be given
my leave. I feel that I could enjoy myself, in spite of the fact that it is such a long time
Please write some more chirpy letters and write them more frequently than has been the
case lately.",,
